{
  "schema_version": "ranger.electromagnetic-actuation-trial.v0.1",
  "trial_id": "em-trial-blocked-001",
  "apparatus_id": "ets-em-captive-demo-001",
  "occurred_at": "2026-09-12T04:05:00Z",
  "authority": {
    "principal_id": "operator-research-001",
    "authorization_state": "AUTHORIZED",
    "policy_id": "policy-em-demo-safe-v0.1"
  },
  "safety_state": {
    "enclosure_state": "CLOSED",
    "interlock_state": "SATISFIED",
    "hardware_limit_state": "LIMITED",
    "safe_to_actuate": true,
    "reason": "Approved blocked-motion fixture installed for evidence-path test."
  },
  "command": {
    "command_id": "cmd-em-002",
    "requested_action": "captive_electromagnetic_actuation",
    "command_state": "ISSUED",
    "issued_at": "2026-09-12T04:05:00.100Z",
    "reason": null
  },
  "observations": [
    {
      "observation_id": "obs-i-002",
      "kind": "ACTUATION_CURRENT",
      "source_id": "sensor-current-001",
      "captured_at": "2026-09-12T04:05:00.105Z",
      "measurement": {"state": "KNOWN", "value": 3.1, "unit": "A", "uncertainty": 0.1, "reason": null},
      "source_ancestry": ["sensor-current-001"],
      "independence_group": "electrical-b",
      "quality": "NOMINAL"
    },
    {
      "observation_id": "obs-pos-002",
      "kind": "ARMATURE_POSITION",
      "source_id": "sensor-position-001",
      "captured_at": "2026-09-12T04:05:00.120Z",
      "measurement": {"state": "KNOWN", "value": 0.0, "unit": "mm", "uncertainty": 0.2, "reason": null},
      "source_ancestry": ["sensor-position-001"],
      "independence_group": "motion-a",
      "quality": "NOMINAL"
    },
    {
      "observation_id": "obs-temp-002",
      "kind": "TEMPERATURE",
      "source_id": "sensor-temp-rail-a",
      "captured_at": "2026-09-12T04:05:00.500Z",
      "measurement": {"state": "KNOWN", "value": 25.1, "unit": "degC", "uncertainty": 0.5, "reason": null},
      "source_ancestry": ["sensor-temp-rail-a"],
      "independence_group": "thermal-a",
      "quality": "NOMINAL"
    }
  ],
  "result": {
    "electrical_response": "OBSERVED",
    "mechanical_response": "BLOCKED",
    "thermal_response": "OBSERVED",
    "final_safe_state": "CONFIRMED",
    "interpretation": "Command and electrical response occurred, but captive motion was intentionally blocked. Controller command state is therefore not treated as proof of mechanical consequence."
  },
  "previous_trial_digest": null,
  "trial_digest": null,
  "evidence": [
    {
      "evidence_id": "artifact-em-blocked-001",
      "evidence_type": "timeseries",
      "source_id": "daq-001",
      "captured_at": "2026-09-12T04:05:00.500Z",
      "digest": "sha256:bbbbbbbbbbbbbbbbbbbbbbbbbbbbbbbbbbbbbbbbbbbbbbbbbbbbbbbbbbbbbbbb",
      "uri": null
    }
  ],
  "signature": null
}
