{
  "schema_version": "ranger.electromagnetic-actuation-trial.v0.1",
  "trial_id": "em-trial-degraded-sensor-001",
  "apparatus_id": "ets-em-captive-demo-001",
  "occurred_at": "2026-09-12T04:25:00Z",
  "authority": {
    "principal_id": "operator-research-001",
    "authorization_state": "AUTHORIZED",
    "policy_id": "policy-em-demo-safe-v0.1"
  },
  "safety_state": {
    "enclosure_state": "CLOSED",
    "interlock_state": "SATISFIED",
    "hardware_limit_state": "READY",
    "safe_to_actuate": true,
    "reason": null
  },
  "command": {
    "command_id": "cmd-em-degraded-001",
    "requested_action": "captive_electromagnetic_actuation",
    "command_state": "ISSUED",
    "issued_at": "2026-09-12T04:25:00.100Z",
    "reason": null
  },
  "observations": [
    {
      "observation_id": "obs-current-degraded-001",
      "kind": "ACTUATION_CURRENT",
      "source_id": "sensor-current-001",
      "captured_at": "2026-09-12T04:25:00.105Z",
      "measurement": {"state": "NOT_AVAILABLE", "unit": "A", "uncertainty": null, "reason": "Current sensor reported a diagnostic fault during the capture window."},
      "source_ancestry": ["sensor-current-001"],
      "independence_group": "electrical-b",
      "quality": "DEGRADED"
    },
    {
      "observation_id": "obs-position-degraded-001",
      "kind": "ARMATURE_POSITION",
      "source_id": "sensor-position-001",
      "captured_at": "2026-09-12T04:25:00.120Z",
      "measurement": {"state": "KNOWN", "value": 7.7, "unit": "mm", "uncertainty": 0.2, "reason": null},
      "source_ancestry": ["sensor-position-001"],
      "independence_group": "motion-a",
      "quality": "NOMINAL"
    },
    {
      "observation_id": "obs-temp-degraded-001",
      "kind": "TEMPERATURE",
      "source_id": "sensor-temp-rail-a",
      "captured_at": "2026-09-12T04:25:00.500Z",
      "measurement": {"state": "KNOWN", "value": 25.1, "unit": "degC", "uncertainty": 0.5, "reason": null},
      "source_ancestry": ["sensor-temp-rail-a"],
      "independence_group": "thermal-a",
      "quality": "NOMINAL"
    }
  ],
  "result": {
    "electrical_response": "UNKNOWN",
    "mechanical_response": "OBSERVED",
    "thermal_response": "OBSERVED",
    "final_safe_state": "CONFIRMED",
    "interpretation": "Motion and thermal response were observed, but the electrical response remains unknown because the current sensor was unavailable."
  },
  "previous_trial_digest": null,
  "trial_digest": null,
  "evidence": [
    {
      "evidence_id": "artifact-em-degraded-001",
      "evidence_type": "timeseries",
      "source_id": "daq-001",
      "captured_at": "2026-09-12T04:25:00.500Z",
      "digest": "sha256:dddddddddddddddddddddddddddddddddddddddddddddddddddddddddddddddd",
      "uri": null
    }
  ],
  "signature": null
}
